id,type,title,display_entry,abstract,link,extent,date
8211846,696,"Robert Motherwell interview, 1981 Feb. 15.","Motherwell, Robert. Robert Motherwell interview, 1981 Feb. 15.",An interview of Robert Motherwell conducted by Phyllis Tuchman for the Archives of American Art's Mark Rothko and His Times oral history project. ,http://www.worldcat.org/oclc/78142078,Sound recording: 2 cassettes : analog.Transcript: 15 p.,
6867947,696,"Lord - Adams Family Papers, 1848-1912, 1862-1878 (bulk).","Lord - Adams Family. Lord - Adams Family Papers, 1848-1912, 1862-1878 (bulk).","Civil War letters from William Lord (d. 1863) of 144th N.Y. Volunteers to his wife Mary of Lordville, Delaware County; also letters from her brothers Jonathan and L.M. Adams, in service, and from her sister Sarah Adams. Also deeds to and from Mary Lord, her marriage certificate, pension letters, and poems. ",http://www.worldcat.org/oclc/155432132,88 items,
8322914,696,"Arthur Purdy collection, ca. 1933-1995.","Purdy, Arthur C., 1908-1995. Arthur Purdy collection, ca. 1933-1995.","Collection includes architectural drawings, office materials, and photographs for many of Purdy's residential designs in the suburbs of Chicago and residential and commercial buildings in Chicago. Also includes a small grouping of material about projects designed by others. ",http://www.worldcat.org/oclc/84566479,"1 box (0.5 linear feet), 2 portfolios and oversize materials.",
6399395,696,"Martin P. Catherwood. New York State Joint Legislative Committee on the Taylor Law, staff member's files, 1971-1972.","Martin P. Catherwood. New York State Joint Legislative Committee on the Taylor Law, staff member's files, 1971-1972.","Include selected testimony, minutes of executive sessions, correspondence and the Committee's final report.",http://rmc.library.cornell.edu/EAD/xml/dlxs/KCL05209.xml,"",
7704804,696,"Minute book, 1865-1874.","Freemasons. South Carolina. Royal Arch Masons. Bazaleel Chapter, No. 8 (Hamburg, S.C.). Minute book, 1865-1874.","Minutes of regular and called meetings of the masonic lodge, 1865-1868, 1874, identifying members and officers of Royal Arch Masons. Bazaleel Chapter, No. 8 (Hamburg, S.C.). ",http://www.worldcat.org/oclc/55515742,1 v.,
6728082,696,"Papers, 1840-1895 (inclusive).","Van Deventer, Abram G. Papers, 1840-1895 (inclusive).","""Bills, receipts, documents, etc., 1840-1895. Also bills, etc., 1859-1860, of Isaac G. Van Deventer."" ",http://www.worldcat.org/oclc/122477513,158 items (2 folders),
7165209,696,"Dictation for Mason B. Carpenter : Denver, Arapahoe County : ms., [ca. 1885-1887].","Carpenter, Mason B., 1845-. Dictation for Mason B. Carpenter : Denver, Arapahoe County : ms., [ca. 1885-1887].","Part of a collection of dictations and some agent reports. Generally, materials concern social life and customs in Colorado. ",http://www.worldcat.org/oclc/26567924,Originals : 1 leaf.Copies : partial microfilm reel : negative (Rich. 116:14) and positive.,
6538879,696,"Co. Camb.: Cambridge, University, 1590-1718. Unspecified","Co. Camb.: Cambridge, University, 1590-1718.","",http://searcharchives.bl.uk/primo_library/libweb/action/search.do?srt=rank&ct=search&mode=Basic&indx=1&vl(freeText0)=036-002183973&fn=search&vid=IAMS_VU2,10 items,
6508197,696,"Carter White House Photographs Collection. 1/20/1977 - 1/22/1981. Carter White House Photographs: Presidential. 1/20/1977 - 1/22/1981. Jimmy Carter - Visits Dr. and Mrs. Lukash and new baby girl, Fr. 1A-14A; Jogging, Fr. 15A-22A","Carter White House Photographs Collection. 1/20/1977 - 1/22/1981. Carter White House Photographs: Presidential. 1/20/1977 - 1/22/1981. Jimmy Carter - Visits Dr. and Mrs. Lukash and new baby girl, Fr. 1A-14A; Jogging, Fr. 15A-22A",,https://catalog.archives.gov/id/844694,,
7633542,696,"Arts and Crafts, Adrian Cobb, woodcarver, Harrison, Ark., April, 1960 [With dove] [graphic] / Ernie Deane [photographer]. 1960.","Deane, Ernie. Arts and Crafts, Adrian Cobb, woodcarver, Harrison, Ark., April, 1960 [With dove] [graphic] / Ernie Deane [photographer].","Negative taken for April 19, 1960, Arkansas Gazette article ""Carver Brings Beauty to Churches,"" B1:2. Adrian Cobb (1906-1992) of Newton County, Arkansas is a wood carver for Turney Wood Products Company of Harrison, Boone County, Arkansas. He displays a wooden dove which will decorate a church alter (1830.1). ",http://www.worldcat.org/oclc/50903331,1 negative : b&w ; 6 x 6 cm. (2 x 2 in.),
7178867,696,"Autograph letter signed (third person) : to Sir George Howland Beaumont, 1822 Mar. 13.","Camuccini, Vincenzo, 1771-1844. Autograph letter signed (third person) : to Sir George Howland Beaumont, 1822 Mar. 13.",Accepting an invitation. ,http://www.worldcat.org/oclc/270133699,1 item (1 p.) ; (12mo),
8274313,696,Archief (1908-) 1930-1987.,Algemene Nederlandse Vereniging voor Sociale Geneeskunde. Archief (1908-) 1930-1987.,"Notulen en andere vergaderstukken, statuten en huishoudelijke reglementen, ledenlijsten, jaarverslagen, correspondentie, financiële stukken; stukken van de verschillende secties, onder andere Nederlandse Vereniging voor de Jeugdgezondheidszorg, Nederlandse Vereniging voor Arbeids- en Bedrijfsgeneeskunde en de sectie Milieuhygiëne; stukken betreffende het Tijdschrift voor Sociale Geneeskunde en het specialisme sociale geneeskunde; enige foto's; Vereeniging tot beoefening der Ongevallen-Geneeskunde/Vereeniging tot beoefening der Sociale Geneeskunde: notulenboek 1908-1928; Nederlandsche Vereeniging voor Gemeentelijke Geneeskundige Verzorging: notulen (ook van gecombineerde vergaderingen met de Nederlandsche Vereeniging van Schoolartsen), reglementen, ledenlijsten, jaarverslagen, correspondentie; bevat ook enige stukken van de Nederlandsche Vereeniging van Schoolartsen. ",http://www.worldcat.org/oclc/81998213,5.5 m.,
7612034,696,The colonial experience which sticketh closer than a brother / Robert Kreider. [1979],"Kreider, Robert S. The colonial experience which sticketh closer than a brother / Robert Kreider.","",http://www.worldcat.org/oclc/49661208,11 leaves ; 28 cm.,
8249933,696,"Persian [grammar], [17--?].","Jones, William, Sir, 1746-1794. Persian [grammar], [17--?].","",http://www.worldcat.org/oclc/80688965,1 v. ; 31.5 x 20.5 cm.,
7762702,696,"Notes on lectures by Rev. Dr. Labaree on Natural Theology and evidences of Christianity, Dartmouth College, Hanover, N.H., 1871.","Wiley, George Eddy, 1847-1874. Notes on lectures by Rev. Dr. Labaree on Natural Theology and evidences of Christianity, Dartmouth College, Hanover, N.H., 1871.","In back of v.: Accounts, Jan.-April, 1872. ",http://www.worldcat.org/oclc/5754410,1 v. 20 cm.,
6331797,696,Sylvia Mendlow Papers 1964-1975,"Sylvia Mendlow Papers, 1964-1975","",http://dlib.nyu.edu/findingaids/html/tamwag/wag_035/wag_035.html,3.0 linear feet; (3 boxes),
8078404,696,"Chicago Express (newspaper) operating records, ca. 1972-1974.","Chicago Express, Inc. Chicago Express (newspaper) operating records, ca. 1972-1974.","Correspondence, financial records, memoranda, notes, newspaper clippings, fliers, and other administrative records of Chicago Express, a counter-culture newspaper published weekly or biweekly from 1972 to 1974 by Shoestring Publishing Corporation. Materials chiefly pertain to the buying and selling of advertisements, including correspondence concerning advertising space, advertising rates, and classified advertisements. Also present are newspaper clippings about the Chicago Express and other alternative press publications, as well as materials related to distribution of the newspaper in Chicago neighborhoods. ",http://www.worldcat.org/oclc/711880571,1 linear ft. (3 boxes),
7532919,696,"Records, 1910-1920.","Union Springs Congregational Meeting (Society of Friends : Orthodox : 1910-1920 : Union Springs, N.Y.). Records, 1910-1920.","Records of Union Springs Congregational Meeting, 1910-1920. Includes minutes 1910-20. ",http://www.worldcat.org/oclc/43729500,2 volumes ; .75 linear feet.,
7022396,696,Jingle bells / by Pierpont ; arranged by Gillian Baylow. [198-?],"Pierpont, James, 1822-1893. Jingle bells / by Pierpont ; arranged by Gillian Baylow.","",http://www.worldcat.org/oclc/21929915,1 score ([10] p.) ; 34 cm. + 7 parts ; 28 cm.,
6725907,696,"Case file, 1965-1990.","Maryland. Attorney Grievance Commission. Case file, 1965-1990.","Exhibits, testimony, reports, pleadings, subpoenas, and cost accounts of cases heard by commission.  Also contains similar documents from cases heard by the Maryland State Bar Association prior to 1975. ",http://www.worldcat.org/oclc/122470313,164 cubic ft.,
7965742,696,Opening night of Teʼatroneṭo 2006.,"Allon, Gerard. 880-01 Opening night of Teʼatroneṭo 2006.","",http://www.worldcat.org/oclc/671537819,65 photographs.,
8088580,696,"Speech, 1879.","Horah, James H., 1861-1920. Speech, 1879.",The collection consists of Horah's Inaugural Address as president of the Philanthropic Society in 1879. ,http://www.worldcat.org/oclc/722091200,1 folder.,
6560399,696,"LÉON GOOSSENS COLLECTION. Vol. xxiv.ff. 37. Largest size 370 x 275mm.1.ff. 1-13. Josef Horovitz: 'Sonatina for oboe and piano', 1949. Score (autograph?); part (copy?), lightly annotated in pencil for performance. Dedicated 'to Nadia Boulanger' (f. 1... 1947","LÉON GOOSSENS COLLECTION. Vol. xxiv.ff. 37. Largest size 370 x 275mm.1. ff. 1-13. Josef Horovitz: 'Sonatina for oboe and piano', 1949. Score (autograph?); part (copy?), lightly annotated in pencil for performance. Dedicated 'to Nadia Boulanger' (f. 1..., 1947","",http://searcharchives.bl.uk/primo_library/libweb/action/search.do?srt=rank&ct=search&mode=Basic&indx=1&vl(freeText0)=040-001966437&fn=search&vid=IAMS_VU2,1 item,
8009380,696,[Minor publications].,"Taxpayers' League of St. Louis County, Inc. (Duluth, Minn). [Minor publications].","",http://www.worldcat.org/oclc/701755885,v. 30 cm.,
6953485,696,"Office files of The American Poetry Review, 1977.","Ruhl, Steven. Office files of The American Poetry Review, 1977.","Comprises  1 item, 1 leaf correspondence. ",http://www.worldcat.org/oclc/188879153,1 folder.,
7077925,696,Papers. 1888-1973.,"Baracchi, Pietro, b. 1851. Papers.","Papers relating to the personal and public life of Baracchi include diaries, scientific notes, records of field trips, photographs and pamphlets. The diaries are of his retirement trip to Europe (1922-1925), a diary kept at the meeting of the Australasian Association for the Advancement of Science in Sydney (1898), a diary relating to the astronomical observatory at Mt Stromlo (1911-1913), notes on Baracchi's tours of Victoria, notes of his reading on astronomy including Halley's Comet, and notes relating to his son Guido, including his imprisonment. The formal and informal portraits are mainly of Pietro and his son Guido and their families. ",http://www.worldcat.org/oclc/225851367,28 cm. (2 boxes) + 1 folio.,
7118884,696,"Genealogical papers relating to the Root family, 1900-1915, 1930s.","Root, Joseph Cullen, 1844-1913. Genealogical papers relating to the Root family, 1900-1915, 1930s.","Largely voluminous correspondence with relatives in request of information on members of the Root family, including family record and lineage questionnaires, and copious notes. The collection contains a series of notebooks with information on more than 7000 members of the Root family, including notebooks of information on miscellaneous untraced individuals. There are also postcards of the ancestral home of the Root family in Badby, North Hamptonshire, England, and name/address lists, coats of arms, and card files of individuals, all pertaining to a compilation of the Root family genealogy. ",http://www.worldcat.org/oclc/23730646,8.50 linear ft.,
7156727,696,"Dictation from D.F. Stuart : Houston, Texas : ms., 1888.","Stuart, D. F., 1833-. Dictation from D.F. Stuart : Houston, Texas : ms., 1888.","",http://www.worldcat.org/oclc/26150307,Originals : 1 leaf.Copies : partial microfilm reel (109 exposures) : negative (Rich. 118:1) and positive.,
8122886,696,"Virginia R. Harshman papers, 1980-2005.","Harshman, Virginia R. Virginia R. Harshman papers, 1980-2005.","The Harshman Collection includes the author's book as well as documents and maps related to the Lytle Creek area, and photographs of the Fontana Union Water Company. ",http://www.worldcat.org/oclc/747837489,1 box.,
7157228,696,"Oliver Boardman Huntington journals, 1843-1900.","Huntington, Oliver Boardman, 1823-1907. Oliver Boardman Huntington journals, 1843-1900.","Member of a prominent Mormon family, Huntington wrote up his journals in ""historical style,"" with much information concerning his father William, brothers Dimick and William, and sisters Zina and Prescindia. Describes experiences from 1835 with the Mormons in Ohio, Missouri, and Illinois; missionary tour of 1843 to the Eastern States; life in Nauvoo on terms of intimacy with Joseph Smith's family, 1844-1845; mission to England, 1846-1847; migration to Utah, 1848; and return east next spring; return to Utah from New York State; life in Salt Lake City and Springville, 1852-1862. Journeys to Carson Valley in 1854 and 1857 by routes south of the Humboldt River; the Elk Mountain Mission of 1855 to southeastern Utah; exploration of the Deep Creek area, and the handcart relief, 1856; colonizing in Washington County in Southern Utah, 1862-1864; life afterward at Springville as farmer, beekeeper, and school teacher, with reminiscences concerning Joseph Smith and the early history of the Church. ",http://www.worldcat.org/oclc/26178849,2 microfilm reels : positive.,
7487491,696,"Papers, 1900-1913.","Moody, George H., 1853-. Papers, 1900-1913.","Bills and receipts of a Moscow, Idaho, monument dealer, including bills for electric power, for a hospital visit, and  from many other Moscow businesses.  There are bills for music lessons from Margaret Lauder Gerlough and some calling cards and party invitations to Mrs. Moody. ",http://www.worldcat.org/oclc/42927006,1 folder.,
7903945,696,[Toby Burke : Australian and New Zealand Art Files].,"Burke, Toby. [Toby Burke : Australian and New Zealand Art Files].","",http://www.worldcat.org/oclc/638873117,1 file.,
6370283,696,Columbia Transportation Company records 1863-1864,"Columbia Transportation Company records, 1863-1864","Collection includes: Records of the Columbia Transportation Company, Portland, Oregon, 1 v, 1863-1864, with expenses and accounts of the steamboat business operating on Columbia and Willamette rivers.",http://nwda.orbiscascade.org/ark:/80444/xv35025,.08 cubic feet (1 folder),
6625489,696,"Herman Glenn Baity Papers, 1900s-1970s","Herman Glenn Baity Papers, 1900s-1970s","Herman Glenn Baity, internationally known sanitary engineer and professor of sanitary engineering at the University of North Carolina, 1926-1955. Correspondence, writings, subject files, travel diaries, photographs, film strips, and other materials documenting Herman Glenn Baity's career as an academician and international consultant, particularly in South America; his role in developing water and sewer plants throughout North Carolina; and his tenure as director of sanitary engineering for the World Health Organization in Geneva, Switzerland. Also included are materials relating to Baity's father, George Wesley Baity; to his wife, ethnologist Elizabeth Chesley Baity (1907- ); and to other Baity and Chesley family members.","http://www2.lib.unc.edu/mss/inv/b/Baity,Herman_Glenn.html",6800; 19.5,
7713409,696,The Arab revolt of 1936 - 1939 in Palestine : [MiKroform] a study based on oral sources / Sonia Fathi el- Nimr. 1990.,"Nimr, Sonia Fathi el-. The Arab revolt of 1936 - 1939 in Palestine : [MiKroform] a study based on oral sources / Sonia Fathi el- Nimr.","",http://www.worldcat.org/oclc/558819299,1 Mikrofilm 272 S : Kt.,
6674174,696,"[Minutes, 1923-1935] / Westminster Guild, Q.S.S. Chapter, of the Bellefield Presbyterian Church.","Bellefield Presbyterian Church (Pittsburgh, Pa.). Westminster Guild. Q.S.S. chapter. [Minutes, 1923-1935] / Westminster Guild, Q.S.S. Chapter, of the Bellefield Presbyterian Church.","",http://www.worldcat.org/oclc/11003499,3 v. ; 20-23 cm.,
7961480,696,"Chestnut Street Associates' Records, 1947-1953 .","Chestnut Street Associates (Salem, Mass). Chestnut Street Associates' Records, 1947-1953 .","Collection includes bylaws for the neighborhood organization, correspondence, deeds, pamphlets for ""Chestnut Street Day"" and accountings of donations made for various projects. ",http://www.worldcat.org/oclc/668211901,1 envelope ( .25 linear feet).,
8169477,696,"Sòm sòm : berceuse / Marie-Louise Lange, Henriette Albespy, chant.","Lange, Marie-Louise. Sòm sòm : berceuse / Marie-Louise Lange, Henriette Albespy, chant.","",http://www.worldcat.org/oclc/766795789,,
6469695,696,"Records of the Environmental Protection Agency. 1944 - 2006. DOCUMERICA: The Environmental Protection Agency's Program to Photographically Document Subjects of Environmental Concern. 1972 - 1977. THE WATKINS OF MULKY SQUARE, A FAMILY OF ELEVEN, LIVE IN THE 1600 BLOCK OF MADISON STREET, A FEW BLOCKS FROM THE AREA BEING CLEARED FOR I-635. THE OLDER WATKINS BOYS TINKER WITH CARS, A FAVORITE OCCUPATION","Records of the Environmental Protection Agency. 1944 - 2006. DOCUMERICA: The Environmental Protection Agency's Program to Photographically Document Subjects of Environmental Concern. 1972 - 1977. THE WATKINS OF MULKY SQUARE, A FAMILY OF ELEVEN, LIVE IN THE 1600 BLOCK OF MADISON STREET, A FEW BLOCKS FROM THE AREA BEING CLEARED FOR I-635. THE OLDER WATKINS BOYS TINKER WITH CARS, A FAVORITE OCCUPATION",,https://catalog.archives.gov/id/553490,,
7175125,696,"Estate records, 1766-1788 (inclusive).","Paar family. Estate records, 1766-1788 (inclusive).","Thirty-three account books, 1766-1770, 1777, 1788; one journal, 1779; and one ledger, 1783, containing estate records of the Paar family of Bohemia (Czechoslovakia). ",http://www.worldcat.org/oclc/269600897,"1 linear ft. (1 case, 2 v.)",
6788665,696,"Papers on the Office of War Information, 1941-1948.","Watkins, Armitage, 1906-. Papers on the Office of War Information, 1941-1948.","Correspondence, memoranda, press releases, documents, photographs, and printed materials of Watkins, reflecting his work with the Office of War Information during World War II. ",http://www.worldcat.org/oclc/122611192,ca. 500 items (2 boxes),
7168386,696,"California railroad notes, [ca. 1850-1932].","Daggett, Stuart, 1881-1954. California railroad notes, [ca. 1850-1932].","Chiefly material gathered for his book, Chapters on the history of the Southern Pacific (N.Y. 1922) Approx. 7,500 pieces; roughly sorted. In folder no. 80 : typed excerpts of letters from Collis P. Huntington to David D. Colton (familiarly known as the ""Colton Letters"") prepared for Daggett's use. ",http://www.worldcat.org/oclc/26681650,3 cartons (142 folders),
7288359,696,Alexandria National Bank [model]. [195-],"Banthrico, Inc. Alexandria National Bank [model].","",http://www.worldcat.org/oclc/306613800,1 model : metal ; 9 x 15 x 9 cm.,
7759123,696,"Autograph letter signed with initials : St. Helena, California, to David Pleydell-Bouverie, 1970 Oct. 1.","Fisher, M. F. K. (Mary Frances Kennedy), 1908-1992. Autograph letter signed with initials : St. Helena, California, to David Pleydell-Bouverie, 1970 Oct. 1.",Thanking him; discussing last-minute preparations for moving; commenting on tiles for Last House. ,http://www.worldcat.org/oclc/570299986,1 item (1 p.) ; 27.8 cm.,
7172664,696,"Records, 1843-1956.","Iowa Universalist Convention. Records, 1843-1956.","Convention records, including notes on and copies of early records, 1843-1909; minutes; registers; lists; financial records; correspondence; nd essays. ",http://www.worldcat.org/oclc/269368325,1 linear ft. (3 boxes).,
7938585,696,"Charles A. Ranlett Papers, 1791-1948; bulk 1824-1865.","Ranlett, Charles Augustus, 1804-1878. Charles A. Ranlett Papers, 1791-1948; bulk 1824-1865.","Salem, MA ship captain. Collection includes logbooks, correspondence, newspapers, account books, printed sailing directions, a fold-out drawing of the Rhine River, and information about the sale of timber. ",http://www.worldcat.org/oclc/650090851,"5 boxes, 1 vol (2.5 linear feet).",
6305252,696,Alumni Association News 1968-,"Alumni Association News, 1968-","",http://archives.library.illinois.edu/archon/?p=collections/controlcard&id=1796,0.60,
8149752,696,A boy driving his father to confession [electronic resource] / by Seamus Heaney. 1970.,"Heaney, Seamus, 1939-. A boy driving his father to confession [electronic resource] / by Seamus Heaney.","",http://www.worldcat.org/oclc/761287039,,
6420901,696,Carter White House Photographs Collection. 1/20/1977 - 1/22/1981. Carter White House Photographs: Presidential. 1/20/1977 - 1/22/1981. Alaskan Briefing,Carter White House Photographs Collection. 1/20/1977 - 1/22/1981. Carter White House Photographs: Presidential. 1/20/1977 - 1/22/1981. Alaskan Briefing,,https://catalog.archives.gov/id/184688,,
7965071,696,"Jesse Applegate letters to Harvey Gordon [manuscripts], 1861-1862.","Gordon, Harvey, 1828-1862. Jesse Applegate letters to Harvey Gordon [manuscripts], 1861-1862.","Manuscript letters to Harvey Gordon from Jesse Applegate, 9 pp, 1861-1862, concerning political matters, corruption, primary elections, comments on the Oregon Argus, Williams for Governor and Yoncalla. ",http://www.worldcat.org/oclc/671240658,9 pp.,
7540447,696,Impeachement; a drama in three acts. c1961.,"LaZebnik, Jack. Impeachement; a drama in three acts.","",http://www.worldcat.org/oclc/44392961,89 l. 28 cm.,
6479116,696,"Records of the Federal Emergency Management Agency. 1956 - 2008. Photographs Relating to Disasters and Emergency Management Programs, Activities, and Officials. 1998 - 9/28/2012. [Hurricane Katrina] Biloxi, Miss., January 7 and August 8, 2006 -- The U.S. Highway 90 bridge destroyed by Hurricane Katrina (top) is now being removed to make way for a new bridge to be constructed in its place. Mark Wolfe/FEMA","Records of the Federal Emergency Management Agency. 1956 - 2008. Photographs Relating to Disasters and Emergency Management Programs, Activities, and Officials. 1998 - 9/28/2012. [Hurricane Katrina] Biloxi, Miss., January 7 and August 8, 2006 -- The U.S. Highway 90 bridge destroyed by Hurricane Katrina (top) is now being removed to make way for a new bridge to be constructed in its place. Mark Wolfe/FEMA",,https://catalog.archives.gov/id/5695526,,
7631917,696,"[Player File. Jenkins, Warren Washington, 1962- / compiled by the National Baseball Hall of Fame Library, Cooperstown, N.Y.].","[Player File. Jenkins, Warren Washington, 1962- / compiled by the National Baseball Hall of Fame Library, Cooperstown, N.Y.].","Player file includes material documenting his baseball career and personal life. These items may include newspaper and magazine articles, biographical material, press releases, copies of original documents, and other sundry items. Some player files may not contain any material due to the brevity of his career and/or the time period in which he played. File contents: folder 1 (1962- ). ",http://www.worldcat.org/oclc/50744455,1 folder.,
7344301,696,"Jeep Holland papers, 1943-1998.","Holland, Jeep, 1943-1998. Jeep Holland papers, 1943-1998.","The collection documents Jeep Holland's personal life and career, particularly the A-Square Record label which he found in 1967. Series consist of administrative files from Discount Records Ann Arbor store and A-Square Records; artist files from groups Jeep worked with, such as MC5, The Stooges, The Rationals, and others; also personal papers; assorted realia such as promotional buttons, sound recordings including 45 rpm singles, photographs, and scrapbooks. ",http://www.worldcat.org/oclc/326833245,12 linear feet (in 13 boxes),
8295341,696,"Classification and Compensation hearing transcripts, 1963, 1966-1968.","New York (State). Classification and Compensation Division. Classification and Compensation hearing transcripts, 1963, 1966-1968.",This series consists of transcripts of these hearings. ,http://www.worldcat.org/oclc/83095416,1 cu. ft.,
8337930,696,Artist file : miscellaneous uncataloged material.,"Nahon, Brigitte, 1960-. Artist file : miscellaneous uncataloged material.","",http://www.worldcat.org/oclc/86101741,1 folder.,
7984403,696,Der Ring an meinem Finger [Multimédia multisupport].,"Schumann, Robert, 1810-1856. Der Ring an meinem Finger [Multimédia multisupport].","",http://www.worldcat.org/oclc/690813609,,
7592127,696,"Letter,1906 Nov 15, New York City [to] Mr. Edwin Markham, Staten Island, New York / Perriton Maxwell. 1906.","Cosmopolitan Magazine. Letter,1906 Nov 15, New York City [to] Mr. Edwin Markham, Staten Island, New York / Perriton Maxwell.",Perriton discusses an article about people who want to make money on child labor. ,http://www.worldcat.org/oclc/48248389,1 p. on 1 leaf ; 15 cm.,
7962268,696,[C.G.W. Schumann Collection] [manuscript]. 1924-1980.,[C.G.W. Schumann Collection] [manuscript].,"",http://www.worldcat.org/oclc/668401520,11 pamphlet boxes ; 40 cm.,
8090546,696,"Correspondence to Chaim Potok, 1971.","Yochelson, Kathryn M. Correspondence to Chaim Potok, 1971.","",http://www.worldcat.org/oclc/724512689,1 item (3 leaves),
7314186,696,"Hercules L. Dousman papers, 1848-1853 [microform].","Dousman, Hercules L. (Hercules Louis), 1800-1868. Hercules L. Dousman papers, 1848-1853 [microform].","Chiefly correspondence between Dousman, a Prairie du Chien, Wisconsin, trader and land speculator, and Henry M. Rice, as well as a few exchanges with Pierre Chouteau, Jr., and Company of St. Louis, Missouri. ",http://www.worldcat.org/oclc/313820257,1 microfilm reel.,
8085771,696,"Garrett family Bible record, 1774-1878.","Garrett family Bible record, 1774-1878.","Other surnames mentioned: Dudley, Harrell, Littlepage, Lumpkin, Pollard, Scott, and Tinsley. ",http://www.worldcat.org/oclc/71799914,5 leaves.,
